{
  "$schema": "https://json-schema.org/draft/2020-12/schema",
  "$id": "https://akm.dev/schemas/server.schema.json",
  "title": "akm server",
  "type": "object",
  "required": ["schemaVersion", "audio", "scServer", "osc", "sources", "reverb", "telemetry"],
  "properties": {
    "schemaVersion": { "type": "string" },
    "audio": {
      "type": "object",
      "required": ["device", "sampleRate", "numInputBusChannels", "numOutputBusChannels", "safetyClipThreshold"],
      "properties": {
        "device": { "type": "string" },
        "inDevice": { "type": "string" },
        "outDevice": { "type": "string" },
        "sampleRate": { "type": "number", "exclusiveMinimum": 0 },
        "numInputBusChannels": { "type": "integer", "minimum": 1 },
        "numOutputBusChannels": { "type": "integer", "minimum": 1 },
        "safetyClipThreshold": { "type": "number", "exclusiveMinimum": 0 }
      }
    },
    "scServer": {
      "type": "object",
      "required": ["numBuffers", "memSize", "numWireBufs", "maxNodes"],
      "properties": {
        "numBuffers": { "type": "integer", "minimum": 1024 },
        "memSize": { "type": "integer", "minimum": 8192 },
        "numWireBufs": { "type": "integer", "minimum": 64 },
        "maxNodes": { "type": "integer", "minimum": 1024 }
      }
    },
    "osc": {
      "type": "object",
      "required": ["listen", "reply"],
      "properties": {
        "listen": {
          "type": "object",
          "required": ["host", "port"],
          "properties": {
            "host": { "type": "string" },
            "port": { "type": "integer", "minimum": 1, "maximum": 65535 }
          }
        },
        "reply": {
          "type": "object",
          "required": ["host", "port"],
          "properties": {
            "host": { "type": "string" },
            "port": { "type": "integer", "minimum": 1, "maximum": 65535 }
          }
        }
      }
    },
    "sources": {
      "type": "array",
      "minItems": 1,
      "items": {
        "type": "object",
        "required": ["id", "inputChannel"],
        "properties": {
          "id": { "type": "string", "minLength": 1 },
          "inputChannel": { "type": "integer", "minimum": 0 }
        }
      }
    },
    "reverb": {
      "type": "object",
      "required": ["decay", "feedback", "subMidEnabled"],
      "properties": {
        "decay": { "type": "number", "minimum": 0 },
        "feedback": { "type": "number", "minimum": 0, "maximum": 1 },
        "subMidEnabled": { "type": "boolean" }
      }
    },
    "telemetry": {
      "type": "object",
      "required": ["stateBroadcastHz", "metersHz"],
      "properties": {
        "stateBroadcastHz": { "type": "number", "minimum": 1, "maximum": 60 },
        "metersHz": { "type": "number", "minimum": 1, "maximum": 60 },
        "perfHz": { "type": "number", "minimum": 1, "maximum": 10 }
      }
    },
    "performance": {
      "type": "object",
      "properties": {
        "pannerUpdateHz": { "type": "number", "minimum": 0, "maximum": 120 }
      }
    },
    "state": {
      "type": "object",
      "description": "Persisted runtime mix state (EQ, filters, gains, mutes). Optional; SC and frontend fall back to internal defaults when missing.",
      "properties": {
        "systemGainDb": { "type": "number" },
        "groupGainsDb": {
          "type": "object",
          "description": "Per-group gain in dB (additive to per-speaker and system gain).",
          "properties": {
            "satellite": { "type": "number" },
            "sub_mid": { "type": "number" },
            "sub_lf": { "type": "number" }
          }
        },
        "speakerGains": {
          "type": "object",
          "description": "Per-speaker gain in dB, keyed by speakerId.",
          "additionalProperties": { "type": "number" }
        },
        "speakerMutes": {
          "type": "object",
          "description": "Per-speaker mute flags, keyed by speakerId.",
          "additionalProperties": { "type": "boolean" }
        },
        "eqByRole": {
          "type": "object",
          "properties": {
            "satellite": { "$ref": "#/$defs/eqState" },
            "sub_mid": { "$ref": "#/$defs/eqState" },
            "sub_lf": { "$ref": "#/$defs/eqState" }
          }
        },
        "filterByRole": {
          "type": "object",
          "properties": {
            "satellite": { "$ref": "#/$defs/filterState" },
            "sub_mid": { "$ref": "#/$defs/filterState" },
            "sub_lf": { "$ref": "#/$defs/filterState" }
          }
        },
        "subMidReverb": {
          "type": "object",
          "properties": {
            "enabled": { "type": "number" },
            "mix": { "type": "number" }
          }
        },
        "systemReverb": {
          "type": "object",
          "properties": {
            "decay": { "type": "number" },
            "feedback": { "type": "number" }
          }
        }
      }
    }
  },
  "$defs": {
    "eqBand": {
      "type": "object",
      "description": "Parametric peak band. v3 dropped the lowShelf/highShelf siblings; the per-role group filter (RHPF/RLPF) handles broad shaping.",
      "properties": {
        "enabled": { "type": "number" },
        "freq": { "type": "number" },
        "gainDb": { "type": "number" },
        "rq": { "type": "number" }
      }
    },
    "eqState": {
      "type": "object",
      "description": "Group EQ. v3 = enabled + three parametric peaks per role.",
      "properties": {
        "enabled": { "type": "number" },
        "peak1": { "$ref": "#/$defs/eqBand" },
        "peak2": { "$ref": "#/$defs/eqBand" },
        "peak3": { "$ref": "#/$defs/eqBand" }
      }
    },
    "filterState": {
      "type": "object",
      "properties": {
        "freq": { "type": "number" },
        "rq": { "type": "number" }
      }
    }
  }
}
