{
  "schemaVersion": "1.0.0",
  "audio": {
    "device": "16A-1",
    "inDevice": "BlackHole 64ch",
    "outDevice": "16A-1",
    "sampleRate": 48000,
    "numInputBusChannels": 32,
    "numOutputBusChannels": 41,
    "safetyClipThreshold": 1
  },
  "scServer": {
    "numBuffers": 4194304,
    "memSize": 2097152,
    "numWireBufs": 2048,
    "maxNodes": 32768
  },
  "osc": {
    "listen": {
      "host": "127.0.0.1",
      "port": 23446
    },
    "reply": {
      "host": "127.0.0.1",
      "port": 23444
    }
  },
  "sources": [
    {
      "id": "src_01",
      "inputChannel": 0
    },
    {
      "id": "src_02",
      "inputChannel": 1
    },
    {
      "id": "src_03",
      "inputChannel": 2
    },
    {
      "id": "src_04",
      "inputChannel": 3
    },
    {
      "id": "src_05",
      "inputChannel": 4
    },
    {
      "id": "src_06",
      "inputChannel": 5
    },
    {
      "id": "src_07",
      "inputChannel": 6
    },
    {
      "id": "src_08",
      "inputChannel": 7
    },
    {
      "id": "src_09",
      "inputChannel": 8
    },
    {
      "id": "src_10",
      "inputChannel": 9
    },
    {
      "id": "src_11",
      "inputChannel": 10
    },
    {
      "id": "src_12",
      "inputChannel": 11
    },
    {
      "id": "src_13",
      "inputChannel": 12
    },
    {
      "id": "src_14",
      "inputChannel": 13
    },
    {
      "id": "src_15",
      "inputChannel": 14
    },
    {
      "id": "src_16",
      "inputChannel": 15
    },
    {
      "id": "src_17",
      "inputChannel": 16
    },
    {
      "id": "src_18",
      "inputChannel": 17
    },
    {
      "id": "src_19",
      "inputChannel": 18
    },
    {
      "id": "src_20",
      "inputChannel": 19
    },
    {
      "id": "src_21",
      "inputChannel": 20
    },
    {
      "id": "src_22",
      "inputChannel": 21
    },
    {
      "id": "src_23",
      "inputChannel": 22
    },
    {
      "id": "src_24",
      "inputChannel": 23
    },
    {
      "id": "src_25",
      "inputChannel": 24
    },
    {
      "id": "src_26",
      "inputChannel": 25
    },
    {
      "id": "src_27",
      "inputChannel": 26
    },
    {
      "id": "src_28",
      "inputChannel": 27
    },
    {
      "id": "src_29",
      "inputChannel": 28
    },
    {
      "id": "src_30",
      "inputChannel": 29
    },
    {
      "id": "src_31",
      "inputChannel": 30
    },
    {
      "id": "src_32",
      "inputChannel": 31
    }
  ],
  "reverb": {
    "decay": 0.5,
    "feedback": 0.5,
    "subMidEnabled": false
  },
  "telemetry": {
    "stateBroadcastHz": 30,
    "metersHz": 20
  },
  "performance": {
    "pannerUpdateHz": 0
  },
  "state": {
    "systemGainDb": -15,
    "speakerGains": {
      "sat_1_1": 0,
      "sat_1_2": 0,
      "sat_1_3": 0,
      "sat_2_1": 0,
      "sat_2_2": 0,
      "sat_2_3": 0,
      "sat_3_1": 0,
      "sat_3_2": 0,
      "sat_3_3": 0,
      "sat_4_1": 0,
      "sat_4_2": 0,
      "sat_4_3": 0,
      "sat_5_1": 0,
      "sat_5_2": 0,
      "sat_5_3": 0,
      "sat_6_1": 0,
      "sat_6_2": 0,
      "sat_6_3": 0,
      "sat_7_1": 0,
      "sat_7_2": 0,
      "sat_7_3": 0,
      "sat_8_1": 0,
      "sat_8_2": 0,
      "sat_8_3": 0,
      "sat_9_1": 0,
      "sat_9_2": 0,
      "sat_9_3": 0,
      "sat_10_1": 0,
      "sat_10_2": 0,
      "sat_10_3": 0,
      "sat_11_1": 0,
      "sat_11_2": 0,
      "sat_11_3": 0,
      "sat_12_1": 0,
      "sat_12_2": 0,
      "sat_12_3": 0,
      "sub_mid_1": 0,
      "sub_mid_2": 0,
      "sub_mid_3": 0,
      "sub_lf_1": 0,
      "sub_lf_2": 0
    },
    "speakerMutes": {
      "sat_1_1": false,
      "sat_1_2": false,
      "sat_1_3": false,
      "sat_2_1": false,
      "sat_2_2": false,
      "sat_2_3": false,
      "sat_3_1": false,
      "sat_3_2": false,
      "sat_3_3": false,
      "sat_4_1": false,
      "sat_4_2": false,
      "sat_4_3": false,
      "sat_5_1": false,
      "sat_5_2": false,
      "sat_5_3": false,
      "sat_6_1": false,
      "sat_6_2": false,
      "sat_6_3": false,
      "sat_7_1": false,
      "sat_7_2": false,
      "sat_7_3": false,
      "sat_8_1": false,
      "sat_8_2": false,
      "sat_8_3": false,
      "sat_9_1": false,
      "sat_9_2": false,
      "sat_9_3": false,
      "sat_10_1": false,
      "sat_10_2": false,
      "sat_10_3": false,
      "sat_11_1": false,
      "sat_11_2": false,
      "sat_11_3": false,
      "sat_12_1": false,
      "sat_12_2": false,
      "sat_12_3": false,
      "sub_mid_1": false,
      "sub_mid_2": false,
      "sub_mid_3": false,
      "sub_lf_1": false,
      "sub_lf_2": false
    },
    "eqByRole": {
      "satellite": {
        "enabled": 1,
        "lowShelf": {
          "enabled": 1,
          "freq": 80,
          "gainDb": 0,
          "rq": 1,
          "type": "lowshelf"
        },
        "peak1": {
          "enabled": 1,
          "freq": 250,
          "gainDb": 0,
          "rq": 1,
          "type": "peak"
        },
        "peak2": {
          "enabled": 1,
          "freq": 1000,
          "gainDb": 2.5,
          "rq": 1.399999976158142,
          "type": "peak"
        },
        "peak3": {
          "enabled": 1,
          "freq": 4000,
          "gainDb": -1.5,
          "rq": 0.8999999761581421,
          "type": "peak"
        },
        "highShelf": {
          "enabled": 1,
          "freq": 10000,
          "gainDb": 1,
          "rq": 0.699999988079071,
          "type": "highshelf"
        }
      },
      "sub_mid": {
        "enabled": 1,
        "lowShelf": {
          "enabled": 1,
          "freq": 80,
          "gainDb": 0,
          "rq": 1,
          "type": "lowshelf"
        },
        "peak1": {
          "enabled": 1,
          "freq": 250,
          "gainDb": 0,
          "rq": 1,
          "type": "peak"
        },
        "peak2": {
          "enabled": 1,
          "freq": 1000,
          "gainDb": 2.5,
          "rq": 1.399999976158142,
          "type": "peak"
        },
        "peak3": {
          "enabled": 1,
          "freq": 4000,
          "gainDb": -1.5,
          "rq": 0.8999999761581421,
          "type": "peak"
        },
        "highShelf": {
          "enabled": 1,
          "freq": 10000,
          "gainDb": 1,
          "rq": 0.699999988079071,
          "type": "highshelf"
        }
      },
      "sub_lf": {
        "enabled": 1,
        "lowShelf": {
          "enabled": 1,
          "freq": 80,
          "gainDb": 0,
          "rq": 1,
          "type": "lowshelf"
        },
        "peak1": {
          "enabled": 1,
          "freq": 250,
          "gainDb": 0,
          "rq": 1,
          "type": "peak"
        },
        "peak2": {
          "enabled": 1,
          "freq": 1000,
          "gainDb": 2.5,
          "rq": 1.399999976158142,
          "type": "peak"
        },
        "peak3": {
          "enabled": 1,
          "freq": 4000,
          "gainDb": -1.5,
          "rq": 0.8999999761581421,
          "type": "peak"
        },
        "highShelf": {
          "enabled": 1,
          "freq": 10000,
          "gainDb": 1,
          "rq": 0.699999988079071,
          "type": "highshelf"
        }
      }
    },
    "filterByRole": {
      "satellite": {
        "freq": 110,
        "rq": 1
      },
      "sub_mid": {
        "freq": 80,
        "rq": 1
      },
      "sub_lf": {
        "freq": 60,
        "rq": 1
      }
    },
    "subMidReverb": {
      "enabled": 0,
      "mix": 0.25
    },
    "systemReverb": {
      "decay": 0.5,
      "feedback": 0.15
    }
  }
}
